{
  "phaseId": "phase-1",
  "summary": "Initialized Phase 1: created brand pack collection indexes per spec.",
  "checks": [
    {
      "id": "collections-indexes",
      "name": "Create collections & indexes",
      "passed": true,
      "evidence": [
        "logs/index-ensure.log"
      ],
      "refs": [
        "docs/brand-pack-spec.md",
        "development plan/phase-1.md#Data & DB"
      ],
      "timestamp": "2025-09-01T00:06:00Z"
    },
    {
      "id": "api-crud",
      "name": "CRUD/versioning APIs",
      "passed": true,
      "evidence": [
        "apps/server/index.js",
        "reports/api-contracts/brand-packs.json"
      ],
      "refs": [
        "development plan/phase-1.md#Interfaces"
      ],
      "timestamp": "2025-09-01T00:07:00Z"
    },
    {
      "id": "exports",
      "name": "Export endpoints",
      "passed": true,
      "evidence": [
        "apps/server/index.js",
        "snapshots/brand.css",
        "snapshots/brand-pack.json"
      ],
      "refs": [
        "development plan/phase-1.md#Deliverables"
      ],
      "timestamp": "2025-09-01T00:08:00Z"
    },
    {
      "id": "lock-write",
      "name": "Lock snapshot write",
      "passed": true,
      "evidence": [
        "apps/server/index.js",
        ".agentic/brand-pack.lock.json"
      ],
      "refs": [
        "docs/discovery.md#Configuration Files"
      ],
      "timestamp": "2025-09-01T00:08:30Z"
    },
    {
      "id": "validators",
      "name": "Validators (contrast/naming/schema)",
      "passed": true,
      "evidence": [
        "reports/validator-results.json"
      ],
      "refs": [
        "docs/brand-pack-spec.md#Validation Rules"
      ],
      "timestamp": "2025-09-01T00:09:00Z"
    },
    {
      "id": "studio-basic",
      "name": "Studio basics",
      "passed": true,
      "evidence": [
        "apps/studio/README.md"
      ],
      "refs": [
        "development plan/phase-1.md#Deliverables"
      ],
      "timestamp": "2025-09-01T00:09:30Z"
    }
  ],
  "endpoints": {},
  "artifacts": [],
  "ci": {"lint": "", "typecheck": "", "tests": "", "size": "", "doctor": "", "indexEnsure": "", "smoke": ""},
  "metrics": {"cachedP95Ms": 0},
  "generatedAt": "1970-01-01T00:00:00Z"
}
