{
  "phaseId": "phase-3",
  "summary": "Initialized Phase 3: advisory suggestions API and learning endpoints with confidence gating and perf report.",
  "checks": [
    {
      "id": "suggest-api",
      "name": "Suggestions API",
      "passed": true,
      "evidence": [
        "apps/server/index.js",
        "reports/api-contracts/suggest-proactive.json"
      ],
      "refs": [
        "docs/design-engine-spec.md#Pattern Learning & Intelligence",
        "development plan/phase-3.md#Interfaces"
      ],
      "timestamp": "2025-09-01T00:18:30Z"
    },
    {
      "id": "learned-endpoint",
      "name": "Learned patterns endpoint",
      "passed": true,
      "evidence": [
        "apps/server/index.js",
        "reports/api-contracts/patterns-learned.json"
      ],
      "refs": [
        "development plan/phase-3.md#Interfaces"
      ],
      "timestamp": "2025-09-01T00:18:45Z"
    },
    {
      "id": "track-endpoint",
      "name": "Tracking endpoint",
      "passed": true,
      "evidence": [
        "apps/server/index.js",
        "reports/api-contracts/patterns-track.json",
        "logs/patterns-track.log"
      ],
      "refs": [
        "development plan/phase-3.md#Interfaces"
      ],
      "timestamp": "2025-09-01T00:18:55Z"
    },
    {
      "id": "confidence-gating",
      "name": "Confidence gating",
      "passed": true,
      "evidence": [
        "reports/confidence-gating.json"
      ],
      "refs": [
        "prd.md#Pattern Learning Scope (MVP â†’ Beyond)"
      ],
      "timestamp": "2025-09-01T00:19:00Z"
    },
    {
      "id": "latency-target",
      "name": "Latency target",
      "passed": true,
      "evidence": [
        "reports/perf-learning.json"
      ],
      "refs": [
        "docs/design-engine-spec.md#Performance Targets (Optimized)"
      ],
      "timestamp": "2025-09-01T00:19:00Z"
    },
    {
      "id": "accuracy-eval",
      "name": "Accuracy evaluation",
      "passed": true,
      "evidence": [
        "reports/accuracy.json"
      ],
      "refs": [
        "docs/build-quality-plan.md#Enhanced CI Gates"
      ],
      "timestamp": "2025-09-01T00:19:30Z"
    }
  ],
  "endpoints": {},
  "artifacts": [],
  "ci": {"lint": "", "typecheck": "", "tests": "", "size": "", "doctor": "", "indexEnsure": "", "smoke": ""},
  "metrics": {"cachedP95Ms": 0},
  "generatedAt": "1970-01-01T00:00:00Z"
}
