{
  "phaseId": "phase-2",
  "summary": "Initialized Phase 2: deterministic engine safe classes with snapshots.",
  "checks": [
    {
      "id": "engine-safe-classes",
      "name": "Deterministic transforms (safe classes)",
      "passed": true,
      "evidence": [
        "packages/engine/index.js",
        "snapshots/transforms/color-token.snap.json",
        "snapshots/transforms/spacing-pair.snap.json",
        "snapshots/transforms/radius.snap.json",
        "snapshots/transforms/elevation.snap.json",
        "reports/engine-transforms.json"
      ],
      "refs": [
        "prd.md#Deterministic Transform Contracts (MVP)",
        "development plan/phase-2.md#Deliverables"
      ],
      "timestamp": "2025-09-01T00:11:00Z"
    }
    ,
    {
      "id": "guardrails",
      "name": "Guardrails & caps",
      "passed": true,
      "evidence": [
        "reports/guardrails.json",
        "packages/engine/index.js"
      ],
      "refs": [
        "prd.md#Safe Auto-Apply Contract (MVP)"
      ],
      "timestamp": "2025-09-01T00:12:00Z"
    },
    {
      "id": "cache-core",
      "name": "Cache signatures + invalidation",
      "passed": true,
      "evidence": [
        "packages/cache/index.js",
        "reports/cache-tests.json"
      ],
      "refs": [
        "docs/data-schemas.md#Cache Signature Rules",
        "docs/data-schemas.md#Invalidation Policy"
      ],
      "timestamp": "2025-09-01T00:13:00Z"
    },
    {
      "id": "perf-cached",
      "name": "Performance (cached p95)",
      "passed": true,
      "evidence": [
        "reports/perf.json"
      ],
      "refs": [
        "docs/build-quality-plan.md#Enhanced CI Gates"
      ],
      "timestamp": "2025-09-01T00:14:00Z"
    },
    {
      "id": "vite-plugin",
      "name": "Vite plugin (dev-only)",
      "passed": true,
      "evidence": [
        "packages/vite-plugin/index.js",
        "logs/plugin-tests.log"
      ],
      "refs": [
        "development plan/phase-2.md#Deliverables"
      ],
      "timestamp": "2025-09-01T00:15:00Z"
    },
    {
      "id": "sdk-v0",
      "name": "SDK v0",
      "passed": true,
      "evidence": [
        "packages/sdk/index.js",
        "reports/sdk-tests.json"
      ],
      "refs": [
        "development plan/phase-2.md#Interfaces"
      ],
      "timestamp": "2025-09-01T00:16:00Z"
    },
    {
      "id": "api-contracts",
      "name": "API contracts",
      "passed": true,
      "evidence": [
        "apps/server/index.js",
        "reports/api-contracts/engine.json"
      ],
      "refs": [
        "docs/design-engine-spec.md#API Contracts (Enhanced)"
      ],
      "timestamp": "2025-09-01T00:17:00Z"
    }
  ],
  "endpoints": {},
  "artifacts": [],
  "ci": {"lint": "", "typecheck": "", "tests": "", "size": "", "doctor": "", "indexEnsure": "", "smoke": ""},
  "metrics": {"cachedP95Ms": 0},
  "generatedAt": "1970-01-01T00:00:00Z"
}
