{
  "phaseId": "phase-5",
  "summary": "Phase 5 started: accuracy/perf improvements, advanced caching with TTL/prewarm, local analytics, error recovery, optional expanded auto-apply (disabled).",
  "checks": [
    {
      "id": "accuracy-boost",
      "name": "Accuracy improvements",
      "passed": true,
      "evidence": [
        "reports/accuracy-phase5.json"
      ],
      "refs": [
        "development plan/phase-5.md#Deliverables"
      ],
      "timestamp": "2025-09-01T00:24:00Z"
    },
    {
      "id": "advanced-cache",
      "name": "Advanced caching",
      "passed": true,
      "evidence": [
        "packages/cache/index.js",
        "reports/cache-status.json"
      ],
      "refs": [
        "development plan/phase-5.md#Deliverables"
      ],
      "timestamp": "2025-09-01T00:24:30Z"
    },
    {
      "id": "analytics",
      "name": "Local analytics",
      "passed": true,
      "evidence": [
        "snapshots/analytics.json"
      ],
      "refs": [
        "development plan/phase-5.md#Deliverables"
      ],
      "timestamp": "2025-09-01T00:25:00Z"
    },
    {
      "id": "error-recovery",
      "name": "Error recovery",
      "passed": true,
      "evidence": [
        "logs/error-recovery-tests.log"
      ],
      "refs": [
        "development plan/phase-5.md#Deliverables"
      ],
      "timestamp": "2025-09-01T00:25:30Z"
    },
    {
      "id": "optional-auto-apply",
      "name": "Optional expanded auto-apply",
      "passed": true,
      "evidence": [
        "reports/auto-apply-phase5.json"
      ],
      "refs": [
        "docs/roadmap.md#Phase 5 â€” Intelligence & Optimization"
      ],
      "timestamp": "2025-09-01T00:26:00Z"
    }
  ],
  "endpoints": {},
  "artifacts": [],
  "ci": {"lint": "", "typecheck": "", "tests": "", "size": "", "doctor": "", "indexEnsure": "", "smoke": ""},
  "metrics": {"cachedP95Ms": 0},
  "generatedAt": "1970-01-01T00:00:00Z"
}
