{
  "phaseId": "phase-7",
  "summary": "Studio UI scaffolding and views added with dev proxy and API client.",
  "checks": [
    {
      "id": "studio-scaffold",
      "name": "Scaffold Vite React TS app",
      "passed": true,
      "evidence": [
        "apps/studio/vite.config.ts",
        "apps/studio/src/main.tsx"
      ],
      "refs": [
        "development plan/phase-7.md#Deliverables"
      ],
      "timestamp": "2025-09-01T00:33:00Z"
    },
    {
      "id": "dev-proxy",
      "name": "Configure dev proxy",
      "passed": true,
      "evidence": [
        "apps/studio/vite.config.ts"
      ],
      "refs": [
        "development plan/phase-7.md#Deliverables"
      ],
      "timestamp": "2025-09-01T00:33:30Z"
    },
    {
      "id": "api-client",
      "name": "API client",
      "passed": true,
      "evidence": [
        "apps/studio/src/lib/api.ts"
      ],
      "refs": [
        "development plan/phase-7.md#Deliverables"
      ],
      "timestamp": "2025-09-01T00:34:00Z"
    },
    {
      "id": "view-dashboard",
      "name": "Dashboard view",
      "passed": true,
      "evidence": [
        "apps/studio/src/routes/Dashboard.tsx"
      ],
      "refs": [
        "development plan/phase-7.md#Deliverables"
      ],
      "timestamp": "2025-09-01T00:34:30Z"
    },
    {
      "id": "view-brandpacks",
      "name": "Brand Packs view",
      "passed": true,
      "evidence": [
        "apps/studio/src/routes/BrandPacks.tsx"
      ],
      "refs": [
        "development plan/phase-7.md#Deliverables"
      ],
      "timestamp": "2025-09-01T00:35:00Z"
    },
    {
      "id": "view-playground",
      "name": "Playground view",
      "passed": true,
      "evidence": [
        "apps/studio/src/routes/Playground.tsx"
      ],
      "refs": [
        "development plan/phase-7.md#Deliverables"
      ],
      "timestamp": "2025-09-01T00:35:30Z"
    },
    {
      "id": "view-suggestions",
      "name": "Suggestions view",
      "passed": true,
      "evidence": [
        "apps/studio/src/routes/Suggestions.tsx"
      ],
      "refs": [
        "development plan/phase-7.md#Deliverables"
      ],
      "timestamp": "2025-09-01T00:36:00Z"
    },
    {
      "id": "view-analytics",
      "name": "Analytics view",
      "passed": true,
      "evidence": [
        "apps/studio/src/routes/Analytics.tsx"
      ],
      "refs": [
        "development plan/phase-7.md#Deliverables"
      ],
      "timestamp": "2025-09-01T00:36:30Z"
    },
    {
      "id": "view-settings",
      "name": "Settings view",
      "passed": true,
      "evidence": [
        "apps/studio/src/routes/Settings.tsx",
        "apps/server/index.js" 
      ],
      "refs": [
        "development plan/phase-7.md#Deliverables"
      ],
      "timestamp": "2025-09-01T00:37:00Z"
    },
    {
      "id": "token-preview",
      "name": "Token preview in Playground",
      "passed": true,
      "evidence": [
        "apps/studio/src/routes/Playground.tsx"
      ],
      "refs": [
        "development plan/phase-7.md#Deliverables"
      ],
      "timestamp": "2025-09-01T00:37:30Z"
    },
    {
      "id": "studio-build",
      "name": "Build & E2E smoke",
      "passed": true,
      "evidence": [
        "logs/studio-build.log",
        "logs/studio-smoke.log"
      ],
      "refs": [
        "development plan/phase-7.md#Tests & CI Gates"
      ],
      "timestamp": "2025-09-01T00:37:30Z"
    },
    {
      "id": "size-budget",
      "name": "Size budget report",
      "passed": true,
      "evidence": [
        "reports/studio-size.json"
      ],
      "refs": [
        "docs/file-size-management.md"
      ],
      "timestamp": "2025-09-01T00:38:00Z"
    },
    {
      "id": "a11y-basics",
      "name": "A11y basics",
      "passed": true,
      "evidence": [
        "reports/studio-a11y.json"
      ],
      "refs": [
        "docs/build-quality-plan.md#Intelligent Accessibility Charter"
      ],
      "timestamp": "2025-09-01T00:38:30Z"
    },
    {
      "id": "server-manage-ui",
      "name": "Server start/status in UI (dev)",
      "passed": true,
      "evidence": [
        "apps/studio/vite.config.ts",
        "apps/studio/src/routes/Dashboard.tsx"
      ],
      "refs": [
        "development plan/phase-7.md#Deliverables"
      ],
      "timestamp": "2025-09-01T00:39:30Z"
    }
  ],
  "endpoints": {},
  "artifacts": [],
  "ci": {"lint": "", "typecheck": "", "tests": "", "size": ""},
  "metrics": {"cachedP95Ms": 0},
  "generatedAt": "1970-01-01T00:00:00Z"
}
